{
  "schema_version": 1,
  "document_id": "tzcup_formal_vehicle_native_brep_reconstruction_manifest_v1",
  "status": "pending_native_brep_reconstruction",
  "claim_boundary": "This is a static, component-addressable reconstruction plan for project-authored geometry. It creates no FCStd, no STEP/STP, no CAD receipt and no manufacturing-release evidence. Existing STL visuals remain non-authoritative display assets and must never be converted to STEP as a substitute for native B-rep feature models.",
  "prohibited_methods": [
    "mesh_to_step_conversion",
    "faceted_or_tessellated_step_export",
    "mesh_import_as_editable_native_cad",
    "using_urdf_collision_or_visual_meshes_as_manufacturing_evidence",
    "placeholder_native_or_step_artifacts"
  ],
  "native_source_root": "starter_ws/src/sanitation_vehicle_description/cad/native_brep/formal_vehicle",
  "step_root": "starter_ws/src/sanitation_vehicle_description/cad/step/formal_vehicle",
  "source_generators": [
    {"id": "product_bodywork", "path": "starter_ws/src/sanitation_vehicle_description/cad/formal_vehicle/generate_product_bodywork_meshes.py", "generated_mesh_count": 47},
    {"id": "cleaning_storage", "path": "starter_ws/src/sanitation_vehicle_description/cad/formal_vehicle/generate_cleaning_storage_meshes.py", "generated_mesh_count": 61},
    {"id": "power_service_hardware", "path": "starter_ws/src/sanitation_vehicle_description/cad/formal_vehicle/generate_power_service_hardware_meshes.py", "generated_mesh_count": 18}
  ],
  "profiles": {
    "bodywork": {
      "dimension_sources": [{"path": "starter_ws/src/sanitation_vehicle_description/cad/formal_vehicle/generate_product_bodywork_meshes.py", "role": "current nominal geometry in metres"}, {"path": "config/high_fidelity_vehicle/formal_vehicle_layout.yaml", "selectors": ["installation_frames", "component_envelopes", "vehicle_envelopes"], "role": "base_footprint packaging and installation authority"}],
      "material_and_mass": {"bom_part_ids": ["bodywork_and_doors", "bodywork_service_safety_system_nominal"], "material_candidate": "uv_stabilized_engineering_polymer_or_coated_sheet_metal_pending", "mass_status": "pending_final_cad_material_and_weighing"},
      "interface": {"xacro": "starter_ws/src/sanitation_vehicle_description/urdf/high_fidelity/bodywork.xacro", "component_register_subassemblies": ["bodywork_service_access", "warning_and_work_lighting", "front_contact_safety", "rear_contact_safety"]},
      "coordinate_system": {"mesh_units": "m", "placement_authority": "URDF visual origin plus formal_vehicle_layout.yaml installation_frames", "installation_reference_frame": "base_footprint", "native_part_rule": "rebuild a part-local feature model; preserve the documented URDF link transform rather than vertex-position offsets"}
    },
    "cleaning": {
      "dimension_sources": [{"path": "starter_ws/src/sanitation_vehicle_description/cad/formal_vehicle/generate_cleaning_storage_meshes.py", "role": "current nominal geometry in metres"}, {"path": "config/high_fidelity_vehicle/formal_vehicle_layout.yaml", "selectors": ["cleaning_geometry", "installation_frames", "component_envelopes"], "role": "working widths, travel and packaging"}],
      "material_and_mass": {"bom_part_ids": ["cleaning_recovery_system_nominal", "squeegee_suction_hoses", "recovery_filter"], "material_candidate": "chemical_compatible_polymer_stainless_steel_and_elastomer_pending", "mass_status": "pending_final_cad_material_and_weighing"},
      "interface": {"xacro": "starter_ws/src/sanitation_vehicle_description/urdf/high_fidelity/cleaning_mechanism.xacro", "component_register_subassemblies": ["side_sweeping", "main_sweeping", "cleaning_head_lift", "water_gathering", "water_intake", "water_filtering"]},
      "coordinate_system": {"mesh_units": "m", "placement_authority": "URDF visual origin plus formal_vehicle_layout.yaml installation_frames", "installation_reference_frame": "base_footprint", "native_part_rule": "rebuild a part-local feature model and retain joint/link interfaces as explicit datums"}
    },
    "storage": {
      "dimension_sources": [{"path": "starter_ws/src/sanitation_vehicle_description/cad/formal_vehicle/generate_cleaning_storage_meshes.py", "role": "current nominal geometry in metres"}, {"path": "config/high_fidelity_vehicle/formal_vehicle_layout.yaml", "selectors": ["storage", "installation_frames", "component_envelopes"], "role": "dry/wet capacity and installation envelope"}],
      "material_and_mass": {"bom_part_ids": ["storage_waste_system_nominal", "dry_bin", "wastewater_tank"], "material_candidate": "chemical_compatible_polymer_stainless_steel_and_elastomer_pending", "mass_status": "pending_final_cad_material_and_weighing"},
      "interface": {"xacro": "starter_ws/src/sanitation_vehicle_description/urdf/high_fidelity/storage_system.xacro", "component_register_subassemblies": ["dry_storage", "wastewater_storage", "robot_deposition_port", "wet_fill_monitor"]},
      "coordinate_system": {"mesh_units": "m", "placement_authority": "URDF visual origin plus formal_vehicle_layout.yaml installation_frames", "installation_reference_frame": "base_footprint", "native_part_rule": "rebuild part-local datums for lid, latch, hopper, drain and mounting interfaces"}
    },
    "power_distribution": {
      "dimension_sources": [{"path": "starter_ws/src/sanitation_vehicle_description/cad/formal_vehicle/generate_cleaning_storage_meshes.py", "role": "current nominal geometry in metres"}, {"path": "config/high_fidelity_vehicle/formal_vehicle_layout.yaml", "selectors": ["physical_power_service_layout", "installation_frames"], "role": "power packaging"}],
      "material_and_mass": {"bom_part_ids": ["power_distribution"], "material_candidate": "electrical_enclosure_material_and_busbar_insulation_pending", "mass_status": "pending_power_topology_supplier_selection_and_weighing"},
      "interface": {"xacro": "starter_ws/src/sanitation_vehicle_description/urdf/high_fidelity/a300_platform.xacro", "component_register_subassemblies": ["fused_power_distribution"]},
      "coordinate_system": {"mesh_units": "m", "placement_authority": "URDF visual origin plus formal_vehicle_layout.yaml installation_frames", "installation_reference_frame": "base_footprint", "native_part_rule": "rebuild part-local enclosure and mounting datums; do not infer electrical clearances from the mesh"}
    },
    "charge_interface": {
      "dimension_sources": [{"path": "starter_ws/src/sanitation_vehicle_description/cad/formal_vehicle/generate_power_service_hardware_meshes.py", "role": "current nominal geometry in metres"}, {"path": "config/high_fidelity_vehicle/formal_vehicle_component_register.yaml", "selectors": ["functional_positions.charge_interface"], "role": "joint and service interface chain"}],
      "material_and_mass": {"bom_part_ids": ["charge_and_drain"], "material_candidate": "weatherproof_polymer_or_coated_metal_and_contact_material_pending", "mass_status": "pending_component_selection_and_ingress_test"},
      "interface": {"xacro": "starter_ws/src/sanitation_vehicle_description/urdf/high_fidelity/power_service_hardware.xacro", "component_register_subassemblies": ["charge_interface"]},
      "coordinate_system": {"mesh_units": "m", "placement_authority": "URDF visual origin plus formal_vehicle_layout.yaml installation_frames", "installation_reference_frame": "base_footprint", "native_part_rule": "rebuild part-local service and hinge datums, then mate with the charged-interface links"}
    },
    "wastewater_drain": {
      "dimension_sources": [{"path": "starter_ws/src/sanitation_vehicle_description/cad/formal_vehicle/generate_power_service_hardware_meshes.py", "role": "current nominal geometry in metres"}, {"path": "config/high_fidelity_vehicle/formal_vehicle_component_register.yaml", "selectors": ["functional_positions.wastewater_drain"], "role": "service, valve and hose interface chain"}],
      "material_and_mass": {"bom_part_ids": ["charge_and_drain", "wastewater_tank"], "material_candidate": "chemical_compatible_polymer_stainless_steel_and_elastomer_pending", "mass_status": "pending_component_selection_pressure_test_and_weighing"},
      "interface": {"xacro": "starter_ws/src/sanitation_vehicle_description/urdf/high_fidelity/power_service_hardware.xacro", "component_register_subassemblies": ["wastewater_drain"]},
      "coordinate_system": {"mesh_units": "m", "placement_authority": "URDF visual origin plus formal_vehicle_layout.yaml installation_frames", "installation_reference_frame": "base_footprint", "native_part_rule": "rebuild part-local pipe, valve and coupling datums and preserve the stated URDF joint chain"}
    }
  },
  "assemblies": [
    {"id":"bodywork_assembly","profile":"bodywork","target_native_source":"starter_ws/src/sanitation_vehicle_description/cad/native_brep/formal_vehicle/bodywork/bodywork_assembly.FCStd","target_step_assembly":"starter_ws/src/sanitation_vehicle_description/cad/step/formal_vehicle/bodywork/bodywork_assembly.step","status":"pending_native_brep_reconstruction"},
    {"id":"cleaning_recovery_assembly","profile":"cleaning","target_native_source":"starter_ws/src/sanitation_vehicle_description/cad/native_brep/formal_vehicle/cleaning/cleaning_recovery_assembly.FCStd","target_step_assembly":"starter_ws/src/sanitation_vehicle_description/cad/step/formal_vehicle/cleaning/cleaning_recovery_assembly.step","status":"pending_native_brep_reconstruction"},
    {"id":"storage_waste_assembly","profile":"storage","target_native_source":"starter_ws/src/sanitation_vehicle_description/cad/native_brep/formal_vehicle/storage/storage_waste_assembly.FCStd","target_step_assembly":"starter_ws/src/sanitation_vehicle_description/cad/step/formal_vehicle/storage/storage_waste_assembly.step","status":"pending_native_brep_reconstruction"},